category,statement
Rotating Equipment,GTG-B loss power
Rotating Equipment,"At 2030 hrs, medium pressure compressor manually stopped due to mechanical seal leak badly."
Rotating Equipment,Serendah production lower than target due to medium pressure mechanical seal leaking issues.
Rotating Equipment,"At 1645 hrs, medium pressure compressor start-up after mechanical seal replacement completion."
Process,"1015hours, SNPA triggered PSD 2.0 due to power failure. 1125 hours, SNPA resumed gas export"
Rotating Equipment,SERENDAH GLC remain offline for troubleshooting.
Process,"From 0604 hrs - 0700 hrs, PSD due to loss of power when GTG-B tripped."
